{
  "schema": "mei-llm-cycle-corpus-v1",
  "cycle_id": "exp-000600m",
  "model_id": "mei-1.0-51m",
  "cpt": {
    "mode": "continued_pretraining",
    "parent_cycle": "exp-000300m",
    "delta_release": "mei-artifact://mei-1.0-51m/exp-000600m/corpus/cpt/lm-v2-cpt-600m",
    "scheduled_delta_exposure_tokens": 299999515,
    "actual_cumulative_exposure_tokens": 600001765,
    "cumulative_lineage": ["lm-v1-scratch-four-role-v1", "lm-v2-cpt-600m"],
    "incremental_quotas": {
      "wiki": 166657317,
      "hq": 98372261,
      "structure": 4861154,
      "colloquial": 30108783
    },
    "allow_repeat": false,
    "public_distribution_clearance_asserted": false
  },
  "sft": {"contract": "cycles/mei-1.0-51m/exp-000600m/corpus/sft.json"},
  "eval": {"contract": "cycles/mei-1.0-51m/exp-000600m/corpus/eval.json"},
  "reuse_decisions": [
    {"source": "lm-v1", "action": "reuse_as_parent_lineage", "not_reconsumed_as_delta": true},
    {"source": "lm-v2-cpt-600m", "action": "retire_for_future_reuse", "reason": "corpus_diversity_degraded"}
  ],
  "quality_gates": {
    "hash_and_dedup": "passed",
    "eval_leakage": "passed",
    "template_diversity": "degraded",
    "semantic_consistency": "degraded_or_incomplete",
    "corpus_reuse_eligible": false
  }
}
